Title;Abstract;StoreId;AccessionNumber;AlternateTitle;ArticleType;AuthorAffiliation;Authors;coden;companies;contractNumber;copyright;digitalObjectIdentifier;documentType;elecISSN;elecPubDate;entryDate;isbn;issn;issue;language;languageOfSummary;originalTitle;pages;placeOfPublication;pubdate;pubtitle;publicationType;year;publisher;sourceAttrib;volume;DocumentURL;classification;classificationCodes;documentFeatures;majorClassificationCodes;notes;startPage;subjectClassifications;subjectHeadings;subjectTerms;subjects;FindACopy;Database
The hard work of soft skills: augmenting the project-based learning experience with interdisciplinary teamwork;This two-year qualitative study explored the learning process alongside students’ perceived outcomes within an interdisciplinary project-based learning (PjBL) task. Students from three different undergraduate courses were assigned a project that spanned across all three classes and placed student teams in the roles of client and contractor. Content analysis of reflective journals and focus groups provided a rich view of the learning experience from the student perspective. Findings from Year 1 demonstrated ways in which students had employed soft skills (e.g., communication, collaboration), but also revealed the need for changes to the course design to fully realize the interdisciplinary vision of the project. Findings from Year 2 showed how students negotiated the realistic tensions of the client-contractor relationship while working to develop both soft skills and hard skills (e.g., programming, design, market research). Overall, this study reveals how the interdisciplinary nature of this project supported important aspects of student learning that might not have occurred through a more traditional class project. In addition, it sheds light on the importance of interdisciplinary collaboration among instructors when designing a PjBL experience that pushes students to crosses disciplinary boundaries.;1969425661;;;Scholarly Journals; Oklahoma State University, Stillwater, OK, USA , Oklahoma State University, Stillwater, OK, USA , Oklahoma State University, Stillwater, OK, USA , Oklahoma State University, Stillwater, OK, USA , Virginia Tech, Blacksburg, VA, USA , Oklahoma State University, Stillwater, OK, USA;"Vogler, Jane S;Thompson, Penny;Davis, David W;Mayfield, Blayne E;Finley, Patrick M;Dar Yasseri";;;; Instructional Science is a copyright of Springer, (2017). All Rights Reserved.; 10.1007/s11251-017-9438-9; Journal Article;;; Jun 2018;;0020-4277;3; English; English;; 457-488; Dordrecht;Jun 2018;Instructional Science;;2018;;;46;https://search.proquest.com/docview/1969425661?accountid=11774;;;;;; 457;;; Students , Collaboration , Qualitative research , Learning , Interdisciplinary aspects; Project-based learning , Interdisciplinary , Soft skills , Communication , Design-based research;"http://sfx.nelliportaali.fi/nelli09b?url_ver=Z39.88-2004&amp;rft_val_fmt=info:ofi/fmt:kev:mtx:journal&amp;genre=article&amp;sid=ProQ:ProQ%3Aeducation&amp;atitle=The+hard+work+of+soft+skills%3A+augmenting+the+project-based+learning+experience+with+interdisciplinary+teamwork&amp;title=Instructional+Science&amp;issn=00204277&amp;date=2018-06-01&amp;volume=46&amp;issue=3&amp;spage=457&amp;au=Vogler%2C+Jane+S%3BThompson%2C+Penny%3BDavis%2C+David+W%3BMayfield%2C+Blayne+E%3BFinley%2C+Patrick+M%3BDar+Yasseri&amp;isbn=&amp;jtitle=Instructional+Science&amp;btitle=&amp;rft_id=info:eric/&amp;rft_id=info:doi/10.1007%2Fs11251-017-9438-9";ProQuest Central,Social Science Premium Collection
THE EFFECTIVENESS OF PROJECT-BASED LEARNING METHODOLOGY IN AN EXTERNAL COMMERCE COURSE: A PRELIMINARY ANALYSIS FOR THE COLOMBIAN CARIBBEAN REGION 1;This research article compares a change of cross-curricular competencies and academic performance of two student groups in a Colombian Caribbean University in which one is implemented the Project-Based Learning Methodology (PBL) and the other the traditional teaching. The purpose of this study was to verify whether a change in the learning methodology improves the academic performance and cross-curricular competencies of a sample of 44 students. Data collection instruments included a diagnostic test, the teacher's field work, final academic grades and a focus group. It is found that the application of PBL improved students' academic performance, as well as their cross-curricular competencies increased, in comparison to the non-PBL group regardless of the geographical context.;2124681737;;;Scholarly Journals; Universidad del Norte , Universidad del Norte , Universidad del Norte , Universidad del Norte;"De La Puente, Mario Alberto;Robles, Heydy Selene;Acuña, Luceny Guzman;Delgado, Martha";;;; Copyright Jordan Whitney Enterprises, Inc 2018;; Journal Article;;; 2018;;1533-3604;2; English; English;; 1-15; Arden;2018;Journal of Economics and Economic Education Research;;2018;;;19;https://search.proquest.com/docview/2124681737?accountid=11774;;;;;; 1;;; Teaching , Research , Innovations , Higher education , Students , Theory , Classrooms , Cooperation , Science education , International relations , Engineering , Methods , Problem based learning , Teachers , Colombia;;"http://sfx.nelliportaali.fi/nelli09b?url_ver=Z39.88-2004&amp;rft_val_fmt=info:ofi/fmt:kev:mtx:journal&amp;genre=article&amp;sid=ProQ:ProQ%3Aabiglobal&amp;atitle=THE+EFFECTIVENESS+OF+PROJECT-BASED+LEARNING+METHODOLOGY+IN+AN+EXTERNAL+COMMERCE+COURSE%3A+A+PRELIMINARY+ANALYSIS+FOR+THE+COLOMBIAN+CARIBBEAN+REGION+1&amp;title=Journal+of+Economics+and+Economic+Education+Research&amp;issn=15333604&amp;date=2018-05-01&amp;volume=19&amp;issue=2&amp;spage=1&amp;au=De+La+Puente%2C+Mario+Alberto%3BRobles%2C+Heydy+Selene%3BAcu%C3%B1a%2C+Luceny+Guzman%3BDelgado%2C+Martha&amp;isbn=&amp;jtitle=Journal+of+Economics+and+Economic+Education+Research&amp;btitle=&amp;rft_id=info:eric/&amp;rft_id=info:doi/";ProQuest Central,Social Science Premium Collection
The Effect of Project-based Cooperative Studio Studies on the Basic Electronics Skills of Students’ Cooperative Learning and their Attitudes;Engineering education plays a prominent role in the development of technologies, society, nation, production, economy and employment. It is the art of applying scientific and mathematical principles, and experience to produce a technical product or system to meet out a specific need in the society. Based on the literature, it was thought that implementation of a cooperative project-based education on electrical-electronics engineering students could contribute to their basic engineering skills, their cooperative learning, and their attitudes towards engineering education and occupation. The aim of this study was to reveal the effect of project-based cooperative studio studies on the occupational basic skills of electrical-electronics engineering students, cooperative learning, and their attitudes towards engineering occupation. The research is designed to be a study that is half-experimental and half-quantitative study and was composed of 42 students. Within the research, project-based cooperative studio studies were utilized by the experimental group while the control group had similar course requirements for six weeks, but their practice solely included the content of the Lab II course in the official curriculum. The resulting data was gathered using the Basic Electronics Skills Self-Effacement Scale, the Scale for Attitude towards Cooperative Learning, and the Scale for Attitude towards Engineering and Engineering Education. The results indicate that the project-based cooperative studio studies are contributing more meaningfully to students’ intermediate level electronics skills, and their attitudes towards cooperative learning and towards engineering occupation.;2073358092;;;Scholarly Journals;;KORKMAZ, Özgen;;;; © 2018. Notwithstanding the ProQuest Terms and Conditions, you may use this content in accordance with the associated terms available at http://www.mecs-press.org/ijcnis/terms.html; 10.5815/ijmecs.2018.05.01; Journal Article;;; May 2018;;2075-0161;5; English; English;;; Hong Kong;May 2018;International Journal of Modern Education and Computer Science;;2018;;;10;https://search.proquest.com/docview/2073358092?accountid=11774;;;;;; 1;;; Cooperative learning , Electronics , Students , Learning , Engineering education , Studies , Attitudes , Skills , Curricula , Engineering , Attitudes , Education , Students , Occupations; Project-based learning , cooperative learning , occupational attitudes , basic electronics skills , engineering education;"http://sfx.nelliportaali.fi/nelli09b?url_ver=Z39.88-2004&amp;rft_val_fmt=info:ofi/fmt:kev:mtx:journal&amp;genre=article&amp;sid=ProQ:ProQ%3Aeducation&amp;atitle=The+Effect+of+Project-based+Cooperative+Studio+Studies+on+the+Basic+Electronics+Skills+of+Students%26rsquo%3B+Cooperative+Learning+and+their+Attitudes&amp;title=International+Journal+of+Modern+Education+and+Computer+Science&amp;issn=20750161&amp;date=2018-05-01&amp;volume=10&amp;issue=5&amp;spage=1&amp;au=KORKMAZ%2C+%C3%96zgen&amp;isbn=&amp;jtitle=International+Journal+of+Modern+Education+and+Computer+Science&amp;btitle=&amp;rft_id=info:eric/&amp;rft_id=info:doi/10.5815%2Fijmecs.2018.05.01";ProQuest Central,SciTech Premium Collection,Social Science Premium Collection
High School Students’ Views on the PBL Activities Supported via Flipped Classroom and LEGO Practices;The purpose of this study was to investigate the high school students’ views on instructions based on Flipped Classroom Model (FC) and LEGO applications. The case study, which is one of the qualitative research methods, was used within the scope of the study, the duration of which was 7 weeks. In order to choose the research group of the study, one of the purposeful sampling methods, criterion sampling, was used. In this context, the study was conducted with 35 10th grade high school students from two different classes. EGA (ExperimentalGroupA) consisted of 18 students while EGB (ExperimentalGroupB) consisted of 17 students. Within the scope of the study, algorithm instruction with FC and LEGO applications was conducted on EGA and LEGO applications and algorithm instruction in classroom were conducted on EGB. In accordance with the study, processes of focus group discussions and gathering data through observation were carried out. For the analysis of the data that was gathered, content analysis was performed and NVivo 8 was used. In the end of the study, the students were observed to be having great prejudices and reported negative views in the beginning of the study. Upon the initiation of the study, the prejudices and negative opinions were observed to be replaced by positive opinions. Students mentioned a great deal of educational benefits of the study. They stated that with the study, their motivation and interest in the lesson increased thanks to the implementations. Additionally in the group work, students said that they cooperated, exchanged ideas, shared tasks, took responsibility and socialized with their friends. About FC, students gave positive feedback on the communication opportunities of the atmosphere and they stated that they could repeatedly go beyond the class hours with FC, hence came prepared and saved time. Also students stated that FC atmosphere improved opportunities for teacher-student communication.;2147859217;;;Scholarly Journals;;"Cukurbasi, Baris;Mubin Kiyici";;;; © 2018. This work is published under https://creativecommons.org/licenses/by-nc-nd/3.0/ (the “License”).  Notwithstanding the ProQuest Terms and Conditions, you may use this content in accordance with the terms of the License.;; Journal Article;;; 2018;;1176-3647;2; English; English;; 46-61; Palmerston North;2018;Journal of Educational Technology & Society;;2018;;;21;https://search.proquest.com/docview/2147859217?accountid=11774;;;;;; 46;;; Algorithms , Prejudices , Classrooms , Qualitative research , Sampling methods , Secondary schools , Secondary school students , Positive feedback , Students , Content analysis , Flipped classroom; Flipped classroom , LEGO , Robotic , Algorithm instruction , Problem-based learning;"http://sfx.nelliportaali.fi/nelli09b?url_ver=Z39.88-2004&amp;rft_val_fmt=info:ofi/fmt:kev:mtx:journal&amp;genre=article&amp;sid=ProQ:ProQ%3Aeducation&amp;atitle=High+School+Students%26rsquo%3B+Views+on+the+PBL+Activities+Supported+via+Flipped+Classroom+and+LEGO+Practices&amp;title=Journal+of+Educational+Technology+%26+Society&amp;issn=11763647&amp;date=2018-04-01&amp;volume=21&amp;issue=2&amp;spage=46&amp;au=Cukurbasi%2C+Baris%3BMubin+Kiyici&amp;isbn=&amp;jtitle=Journal+of+Educational+Technology+%26+Society&amp;btitle=&amp;rft_id=info:eric/&amp;rft_id=info:doi/";ProQuest Central,SciTech Premium Collection,Social Science Premium Collection
Fostering Cooperative Learning with Scrum in a Semi-Capstone Systems Analysis and Design Course;Agile methods such as Scrum that emphasize technical, communication, and teamwork skills have been practiced by IT professionals to effectively deliver software products of good quality. The same methods combined with pedagogies of engagement can potentially be used in the setting of higher education to promote effective group learning in software development classrooms. Therefore, the purpose of this study is to integrate both Scrum and cooperative learning guidelines into a systems analysis and design classroom to promote the skills of teamwork, communication, and problem-solving while learning systems analysis and design methods. This integration was implemented in a sophomore, semi-capstone design course where students were engaged in collaborative classroom activities. Two different approaches - overlapped approach and delayed approach - were used in two different semesters for this implementation. Based on the analysis of student performance in the course, student reflections on their team performance, and student overall perceptions of the teaching approach, this study suggests that the integration of cooperative learning and Scrum serves as guidance for students to effectively analyze and design software solutions, as well as to reflect on their team performance and learning process. In addition, a delayed approach for Scrum implementation appears to effectively support student learning by providing better and earlier feedback.;2056814093;;;Scholarly Journals;;"Magana, Alejandra J;Seah, Ying Ying;Thomas, Paul";;;; Copyright EDSIG Spring 2018;; Journal Article;;; Spring 2018;;1055-3096;2; English; English;; 75-91; West Lafayette;Spring 2018;Journal of Information Systems Education;;2018;;;29;https://search.proquest.com/docview/2056814093?accountid=11774;;;;;; 75;;; Information systems , Skills , Systems analysis , Teamwork , Educational technology , Problem solving , Students , Cooperative learning , Design analysis , Software quality , Systems analysis , Project management , Learning , Product development , Classrooms , Design engineering , Information technology , Software engineering , Teamwork , Seminars;;"http://sfx.nelliportaali.fi/nelli09b?url_ver=Z39.88-2004&amp;rft_val_fmt=info:ofi/fmt:kev:mtx:journal&amp;genre=article&amp;sid=ProQ:ProQ%3Aabiglobal&amp;atitle=Fostering+Cooperative+Learning+with+Scrum+in+a+Semi-Capstone+Systems+Analysis+and+Design+Course&amp;title=Journal+of+Information+Systems+Education&amp;issn=10553096&amp;date=2018-04-01&amp;volume=29&amp;issue=2&amp;spage=75&amp;au=Magana%2C+Alejandra+J%3BSeah%2C+Ying+Ying%3BThomas%2C+Paul&amp;isbn=&amp;jtitle=Journal+of+Information+Systems+Education&amp;btitle=&amp;rft_id=info:eric/&amp;rft_id=info:doi/";ProQuest Central,SciTech Premium Collection,Social Science Premium Collection
Coping with Uncertainty in an Agile Systems Development Course;Uncertain and ambiguous environments are commonplace in information systems development (ISD) projects, and while different Agile frameworks welcome changes in organizational, technical, and business environments, the incurred uncertainty is known to negatively affect the development process and the quality of the final product. The effects of uncertainty on ISD projects have been studied in the past in real organizational contexts, but the effects of uncertainty on students in Agile systems development have received less attention from scholars. In this study, we measured the effects of experienced uncertainty on students' performance in an Agile systems development course and how uncertainty affected the quality of the system developed by the students using Scrum. We implemented the course using a problem based learning (PBL) approach and simulated uncertainty through various work environment reflecting concepts. Our study reveals that the effects of uncertainty are fairly similar among students and software professionals, and we identified three different coping strategies that students used with varying degrees of success. We present that learning approaches such as PBL enable a befitting environment for students to acquire hands-on experience in coping with uncertain environments, thus mitigating the problems students are likely to face in their work environments.;2056813906;;;Scholarly Journals;;"Taipalus, Toni;Seppänen, Ville;Pirhonen, Maritta";;;; Copyright EDSIG Spring 2018;; Journal Article;;; Spring 2018;;1055-3096;2; English; English;; 117-126; West Lafayette;Spring 2018;Journal of Information Systems Education;;2018;;;29;https://search.proquest.com/docview/2056813906?accountid=11774;;;;;; 117;;; Teaching , Information systems , Research methodology , Working conditions , Project management , Problem based learning , Systems development , Problem based learning , Uncertainty , Students , Uncertainty , Seminars , Work environment;;"http://sfx.nelliportaali.fi/nelli09b?url_ver=Z39.88-2004&amp;rft_val_fmt=info:ofi/fmt:kev:mtx:journal&amp;genre=article&amp;sid=ProQ:ProQ%3Aabiglobal&amp;atitle=Coping+with+Uncertainty+in+an+Agile+Systems+Development+Course&amp;title=Journal+of+Information+Systems+Education&amp;issn=10553096&amp;date=2018-04-01&amp;volume=29&amp;issue=2&amp;spage=117&amp;au=Taipalus%2C+Toni%3BSepp%C3%A4nen%2C+Ville%3BPirhonen%2C+Maritta&amp;isbn=&amp;jtitle=Journal+of+Information+Systems+Education&amp;btitle=&amp;rft_id=info:eric/&amp;rft_id=info:doi/";ProQuest Central,SciTech Premium Collection,Social Science Premium Collection
Snowman: Agile development method with institutionalized communication and documentation for capstone projects;Numerous organizations currently implement agile methods in practical software development processes. Using agile methods involves mutually strengthening communication to ease the burden involved in documenting plan-driven projects. A focus on people-oriented communication has resulted in agile methods being diverted from development processes that codify formal documents. This situation makes follow-up software maintenance difficult. This paper proposes an appropriate and concrete approach for streamlining communication and documentation in software engineering education called the Snowman approach. The results of evaluations conducted indicate that the proposed Snowman approach enables undergraduate students to learn agile methods and resolves misconceptions surrounding agile methods.;2222925171;;;Scholarly Journals; Department of Information Management, Oriental Institute of Technology, New Taipei City, Taiwan , Department of Information Management, National Central University, Taoyuan City, Taiwan , Department of Information Management, National Central University, Taoyuan City, Taiwan;"Wen-Lung Tsai;Chung-Yang, Chen;Chen, Chun-Shuo";;;; ©2017. College of Management, National Cheng Kung University; 10.1016/j.apmrv.2017.01.002; Journal Article;;; Mar 2018;;1029-3132;1; English; English;; 12-19; Tainan;Mar 2018;Asia Pacific Management Review;;2018;;;23;https://search.proquest.com/docview/2222925171?accountid=11774;;;;;; 12;;; Communication; Agile method , Software development , Software engineering education , Capstone project , Snowman approach;"http://sfx.nelliportaali.fi/nelli09b?url_ver=Z39.88-2004&amp;rft_val_fmt=info:ofi/fmt:kev:mtx:journal&amp;genre=article&amp;sid=ProQ:ProQ%3Aabiglobal&amp;atitle=Snowman%3A+Agile+development+method+with+institutionalized+communication+and+documentation+for+capstone+projects&amp;title=Asia+Pacific+Management+Review&amp;issn=10293132&amp;date=2018-03-01&amp;volume=23&amp;issue=1&amp;spage=12&amp;au=Wen-Lung+Tsai%3BChung-Yang%2C+Chen%3BChen%2C+Chun-Shuo&amp;isbn=&amp;jtitle=Asia+Pacific+Management+Review&amp;btitle=&amp;rft_id=info:eric/&amp;rft_id=info:doi/10.1016%2Fj.apmrv.2017.01.002";ProQuest Central
Snowman: Agile development method with institutionalized communication and documentation for capstone projects;Numerous organizations currently implement agile methods in practical software development processes. Using agile methods involves mutually strengthening communication to ease the burden involved in documenting plan-driven projects. A focus on people-oriented communication has resulted in agile methods being diverted from development processes that codify formal documents. This situation makes follow-up software maintenance difficult. This paper proposes an appropriate and concrete approach for streamlining communication and documentation in software engineering education called the Snowman approach. The results of evaluations conducted indicate that the proposed Snowman approach enables undergraduate students to learn agile methods and resolves misconceptions surrounding agile methods.;2011303051;;;Scholarly Journals;;"Tsai, Wen-Lung;Chen, Chung-Yang;Chen, Chun-Shuo";;;; © 2017 College of Management, National Cheng Kung University; 10.1016/j.apmrv.2017.01.002; Journal Article;;; Mar 2018;;1029-3132;1; English; English;; 12-19; Tainan;Mar 2018;Asia Pacific Management Review;;2018;;;23;https://search.proquest.com/docview/2011303051?accountid=11774;;;;;; 12;;; Information systems , Systems development , Software engineering , Information management , Documentation; Agile method , Software development , Software engineering education , Capstone project , Snowman approach;"http://sfx.nelliportaali.fi/nelli09b?url_ver=Z39.88-2004&amp;rft_val_fmt=info:ofi/fmt:kev:mtx:journal&amp;genre=article&amp;sid=ProQ:ProQ%3Aabiglobal&amp;atitle=Snowman%3A+Agile+development+method+with+institutionalized+communication+and+documentation+for+capstone+projects&amp;title=Asia+Pacific+Management+Review&amp;issn=10293132&amp;date=2018-03-01&amp;volume=23&amp;issue=1&amp;spage=12&amp;au=Tsai%2C+Wen-Lung%3BChen%2C+Chung-Yang%3BChen%2C+Chun-Shuo&amp;isbn=&amp;jtitle=Asia+Pacific+Management+Review&amp;btitle=&amp;rft_id=info:eric/&amp;rft_id=info:doi/10.1016%2Fj.apmrv.2017.01.002";ProQuest Central
