Title;Abstract;StoreId;AccessionNumber;AlternateTitle;ArticleType;AuthorAffiliation;Authors;coden;companies;contractNumber;copyright;digitalObjectIdentifier;documentType;elecISSN;elecPubDate;entryDate;isbn;issn;issue;language;languageOfSummary;originalTitle;pages;placeOfPublication;pubdate;pubtitle;publicationType;year;publisher;sourceAttrib;volume;DocumentURL;classification;classificationCodes;documentFeatures;majorClassificationCodes;notes;startPage;subjectClassifications;subjectHeadings;subjectTerms;subjects;FindACopy;Database
Team Effectiveness Theory from Industrial and Organizational Psychology Applied to Engineering Student Project Teams: A Research Review;  Engineering student team projects are frequently used to meet professional learning outcomes. Industrial and organizational psychologists study teams in the industry settings for which we prepare students, yet this research does not effectively inform engineering education. This research review sought to demonstrate the relevance of literature on teams literature from industrial and organizational psychology to engineering education and to identify implications for practice and future directions for research. Phase 1 systematically reviewed 104 articles published from 2007 to 2012 describing engineering and computer science student team projects and sought to answer the following questions: What professional learning outcomes have been met by team projects? What negative student team behaviors have faculty sought to minimize? What literature has been used to inform development of teamwork outcomes? Phase 2 reviewed five team effectiveness constructs selected according to the results of Phase 1: social loafing, interdependence, conflict, trust, and shared mental models. Examples from Phase 1 articles and our own work explain how this research informs facilitation and assessment of engineering student teams. Engineering faculty sought to achieve a variety of outcomes through team projects, including teamwork, communication, sustainability, and consideration of global/societal design context. They sought to avoid social loafing and conflict while building trust to ensure equal team effort. That few Phase 1 articles engaged the literature about team effectiveness indicates there is great opportunity to apply industrial and organizational psychology research to engineering education.;1636192733;;;Scholarly Journals;;"Borrego, Maura;Karlin, Jennifer;McNair, Lisa D;Beddoes, Kacey"; JEEDEQ;;; Copyright Blackwell Publishing Ltd. Oct 2013;; Feature;;; Oct 2013;;1069-4730;4; English; English;; 472-512; Washington;Oct 2013;Journal of Engineering Education;;2013;;;102;https://search.proquest.com/docview/1636192733?accountid=11774;;; References , Tables , Diagrams;;; 472;;; College students , Teamwork , Education , Teachers , Theory , Behavior , Learning , Creativity , Studies , Computer engineering , Computer science , Software engineering;;"http://sfx.nelliportaali.fi/nelli09b?url_ver=Z39.88-2004&amp;rft_val_fmt=info:ofi/fmt:kev:mtx:journal&amp;genre=article&amp;sid=ProQ:ProQ%3Aeducation&amp;atitle=Team+Effectiveness+Theory+from+Industrial+and+Organizational+Psychology+Applied+to+Engineering+Student+Project+Teams%3A+A+Research+Review&amp;title=Journal+of+Engineering+Education&amp;issn=10694730&amp;date=2013-10-01&amp;volume=102&amp;issue=4&amp;spage=472&amp;au=Borrego%2C+Maura%3BKarlin%2C+Jennifer%3BMcNair%2C+Lisa+D%3BBeddoes%2C+Kacey&amp;isbn=&amp;jtitle=Journal+of+Engineering+Education&amp;btitle=&amp;rft_id=info:eric/&amp;rft_id=info:doi/";ProQuest Central,SciTech Premium Collection,Social Science Premium Collection
IS Learning: The Impact of Gender and Team Emotional Intelligence;  In university settings, dysfunction in teamwork often challenges problem-based learning in IS projects. Researchers of IS Education have largely overlooked Team Emotional Intelligence (TEI), which offers a collective cognitive skill that may benefit the student learning experience. Hypothesized are four dimensions of emotional intelligence (EI) that influence perceived effectiveness in IS learning teams. This paper proposes a model that explains how these four dimensions influence perceived team effectiveness and how gender affects this relationship. A survey administered to 384 students resulting in 94 IS learning teams produced regression (and moderated regression) results showing that gender, along with two TEI dimensions (awareness and management of one's own emotion) predict team effectiveness. Significant results suggest gender differences in the relationship between a team member's awareness of his or her own emotions, management of others' emotions, and team effectiveness. These findings suggest IS educators should focus on targeted interventions that may help to foster the development of emotionally intelligent IS learning teams. Most prominently, gender plays an important role for emotional intelligence competencies, where differences exist in awareness of one's own emotions and management of others' emotions among student learning teams. [PUBLICATION ABSTRACT];1520013603;;;Scholarly Journals;;Dunaway, Mary M;;;; Copyright EDSIG Fall 2013;; Feature;;; Fall 2013;;1055-3096;3; English; English;; 189-202; West Lafayette;Fall 2013;Journal of Information Systems Education;;2013;;;24;https://search.proquest.com/docview/1520013603?accountid=11774;;; References , Tables , Diagrams , Graphs;;; 189;;; Teamwork , Cognition & reasoning , Cooperative education , Skills , Behavior , Learning , Studies , Gender , Emotional intelligence , Problems;;"http://sfx.nelliportaali.fi/nelli09b?url_ver=Z39.88-2004&amp;rft_val_fmt=info:ofi/fmt:kev:mtx:journal&amp;genre=article&amp;sid=ProQ:ProQ%3Aabiglobal&amp;atitle=IS+Learning%3A+The+Impact+of+Gender+and+Team+Emotional+Intelligence&amp;title=Journal+of+Information+Systems+Education&amp;issn=10553096&amp;date=2013-10-01&amp;volume=24&amp;issue=3&amp;spage=189&amp;au=Dunaway%2C+Mary+M&amp;isbn=&amp;jtitle=Journal+of+Information+Systems+Education&amp;btitle=&amp;rft_id=info:eric/&amp;rft_id=info:doi/";ProQuest Central,SciTech Premium Collection,Social Science Premium Collection
Improving Teaching Methodology in System Analysis and Design using Problem Based Learning for ABET;  System Analysis and Design is an active field that demonstrates continuously new techniques and approaches to develop systems more effectively and efficiently. Teaching System Analysis and Design courses are thus quite challenging for many reasons, such as rapid changes in the environment, changes in the nature of technology, demands and needs of the industry and new market trends. These factors will have a direct effect on the students learning and their effectiveness in the place of work. This paper examines this trend and considers Problem Based Learning as the best methodology to respond to them. It will improve the students understanding of the concepts, ideas and thus enhance their learning experience. This paper also examines the level of achievements in the course learning outcomes as outlined by Accreditation Board for Engineering and Technology.;1627736304;;;Scholarly Journals;;"Fatima, Sara;Salha Abdullah";;;; Copyright Modern Education and Computer Science Press Sep 2013; 10.5815/ijmecs.2013.07.07; Journal Article;;; Sep 2013;;2075-0161;7; English; English;; 60-68; Hong Kong;Sep 2013;International Journal of Modern Education and Computer Science;;2013;;;5;https://search.proquest.com/docview/1627736304?accountid=11774;;;;;; 60;;;; System Analysis , Design , Problem based learning , ABET , ACM , KSO , CLO , PEO;"http://sfx.nelliportaali.fi/nelli09b?url_ver=Z39.88-2004&amp;rft_val_fmt=info:ofi/fmt:kev:mtx:journal&amp;genre=article&amp;sid=ProQ:ProQ%3Aeducation&amp;atitle=Improving+Teaching+Methodology+in+System+Analysis+and+Design+using+Problem+Based+Learning+for+ABET&amp;title=International+Journal+of+Modern+Education+and+Computer+Science&amp;issn=20750161&amp;date=2013-09-01&amp;volume=5&amp;issue=7&amp;spage=60&amp;au=Fatima%2C+Sara%3BSalha+Abdullah&amp;isbn=&amp;jtitle=International+Journal+of+Modern+Education+and+Computer+Science&amp;btitle=&amp;rft_id=info:eric/&amp;rft_id=info:doi/10.5815%2Fijmecs.2013.07.07";ProQuest Central,SciTech Premium Collection,Social Science Premium Collection
An Assessment of Educational Benefits from the OpenOrbiter Space Program;"  This paper analyzes the educational impact of the OpenOrbiter Small Spacecraft Development Initiative, a CubeSat development program underway at the University of North Dakota. OpenOrbiter includes traditional STEM activities (e.g., spacecraft engineering, software development); it also incorporates students from non-STEM disciplines not generally involved in aerospace engineering projects such as management, entrepreneurship, education and fine arts. The value of the program to participants is analyzed quantitatively, in terms of improvement related to five key learning objectives.";1554615257;;;Scholarly Journals;;"Straub, Jeremy;Whalen, David";;;; Copyright MDPI AG 2013; 10.3390/educsci3030259; Journal Article;;; 2013;;;3; English; English;; 259-278; Basel;2013;Education Sciences;;2013;;;3;https://search.proquest.com/docview/1554615257?accountid=11774;;; References;;; 259;;; Science education , Experiential learning , Spacecraft , Aerospace engineering; problem-based learning , experiential learning , small spacecraft development , interdisciplinary education;"http://sfx.nelliportaali.fi/nelli09b?url_ver=Z39.88-2004&amp;rft_val_fmt=info:ofi/fmt:kev:mtx:journal&amp;genre=article&amp;sid=ProQ:ProQ%3Aeducation&amp;atitle=An+Assessment+of+Educational+Benefits+from+the+OpenOrbiter+Space+Program&amp;title=Education+Sciences&amp;issn=&amp;date=2013-09-01&amp;volume=3&amp;issue=3&amp;spage=259&amp;au=Straub%2C+Jeremy%3BWhalen%2C+David&amp;isbn=&amp;jtitle=Education+Sciences&amp;btitle=&amp;rft_id=info:eric/&amp;rft_id=info:doi/10.3390%2Feducsci3030259";ProQuest Central,Social Science Premium Collection
A Collaborative Capstone to Develop a Mobile Hospital Clinic Application through a Student Team Competition;"A new collaborative capstone model is presented that consists of three synergistic elements: (1) a capstone course component; (2) a business component; and (3) an advanced technical course component geared towards enhancing the student capstone learning experience. The model was fully implemented at Bentley University in spring 2012 with collaboration among a software project management capstone course, a research and teaching hospital, and a mobile application development course. The capstone project was structured as a student team competition to create the best mobile wayfinding application for patients and employees of Massachusetts General Hospital's clinic and labs. The collaborative capstone teaching methods leading to the successful student team outcomes are presented along with success factors and lessons learned.";1941341909; EJ1145206;;Scholarly Journals;;"Wong, Wilson;Pepe, James;Stahl, James;Englander, Irv";;;;;; Article , Report , 080: Journal Articles , 141: Reports - Descriptive; 1545-679X;; Aug 2013;;;4; English; English;; 39-50;;Aug 2013;Information Systems Education Journal; Scholarly Journals , Reports;2013; http://isedj.org; ERIC, © Information Systems and Computing Academic Professionals;11;https://search.proquest.com/docview/1941341909?accountid=11774;;;;;; 39;;;  4875ER5 5258ER5  4858 5241 ,  1671ER5  1664 ,  6775ER5 9687ER5 6603ER5  6752 9651 6582 ,  10685ER5 4527ER5 912ER5  10642 4511 909 ,  1985ER5 912ER5  1974 909 ,  2236ER5 5901ER5  2225 5882 ,  2070ER5  2059 ,  10724ER5 1873ER5 10713ER5  10680 1862 10669 ,  4612ER5 3351ER5 3567ER5  4595 3337 3553 ,  1815ER5 10321ER5 8043ER5 4558ER5  1806 10278 8016 4542 ,  9207ER5 8800ER5  9174 8768 , Massachusetts; Higher Education , Postsecondary Education , Massachusetts;"http://sfx.nelliportaali.fi/nelli09b?url_ver=Z39.88-2004&amp;rft_val_fmt=info:ofi/fmt:kev:mtx:journal&amp;genre=article&amp;sid=ProQ:ProQ%3Aeric&amp;atitle=A+Collaborative+Capstone+to+Develop+a+Mobile+Hospital+Clinic+Application+through+a+Student+Team+Competition&amp;title=Information+Systems+Education+Journal&amp;issn=1545-679X&amp;date=2013-08-01&amp;volume=11&amp;issue=4&amp;spage=39&amp;au=Wong%2C+Wilson%3BPepe%2C+James%3BStahl%2C+James%3BEnglander%2C+Irv&amp;isbn=&amp;jtitle=Information+Systems+Education+Journal&amp;btitle=&amp;rft_id=info:eric/EJ1145206&amp;rft_id=info:doi/";Social Science Premium Collection
Virtual Teams and Synchronous Presentations: An Online Class Experience;Global expansion, cost containment, and technology advances have all played a role in the increase of virtual teams in today's workplace. Virtual teams in an online graduate information technology management class prepared and presented synchronous presentations over a business or non-profit sector case. This paper includes a brief literature review of virtual teams and synchronous presentations, strategies suggested for virtual teams, the process used for this assignment, and feedback from the students in the course. The students in the course overwhelmingly recommended the format of the virtual team synchronous case assignment for other online projects. Lessons learned as recommendations for future implementation are also included.;1941341166; EJ1145188;;Scholarly Journals;;Adkins, Joni K.;;;;;; Article , Report , 080: Journal Articles , 141: Reports - Descriptive; 1545-679X;; Aug 2013;;;4; English; English;; 61-65;;Aug 2013;Information Systems Education Journal; Scholarly Journals , Reports;2013; http://isedj.org; ERIC, © Information Systems and Computing Academic Professionals;11;https://search.proquest.com/docview/1941341166?accountid=11774;;;;;; 61;;;  10685ER5 4527ER5 912ER5  10642 4511 909 ,  10457ER5 1860ER5  10414 1849 ,  7356ER5 2085ER5 2084ER5 10719ER5 2362ER5 2526ER5  7330 2074 2073 10675 2351 2515 ,  3282ER5 10713ER5  3268 10669 ,  10719ER5  10675 ,  677ER5 5259ER5  675 5242 ,  4467ER5 1815ER5 10321ER5 8043ER5 4558ER5  4452 1806 10278 8016 4542 ,  10219ER5 732ER5  10181 730 ,  10282ER5 9179ER5 126ER5  10240 9146 126 ,  3939ER5 5365ER5 8800ER5  3924 5348 8768; Higher Education , Postsecondary Education;"http://sfx.nelliportaali.fi/nelli09b?url_ver=Z39.88-2004&amp;rft_val_fmt=info:ofi/fmt:kev:mtx:journal&amp;genre=article&amp;sid=ProQ:ProQ%3Aeric&amp;atitle=Virtual+Teams+and+Synchronous+Presentations%3A+An+Online+Class+Experience&amp;title=Information+Systems+Education+Journal&amp;issn=1545-679X&amp;date=2013-08-01&amp;volume=11&amp;issue=4&amp;spage=61&amp;au=Adkins%2C+Joni+K.&amp;isbn=&amp;jtitle=Information+Systems+Education+Journal&amp;btitle=&amp;rft_id=info:eric/EJ1145188&amp;rft_id=info:doi/";Social Science Premium Collection
Doctor of Nursing Practice Programs: Opportunities for Faculty Development: [1];"  This article examines development opportunities for faculty teaching in Doctor of Nursing Practice (DNP) programs. Although faculty development for DNP programs is similar to that of other academic programs, faculty may need different strategies for teaching, scholarship, and service because DNP programs focus on translation of science into practice, systems-level changes, clinical scholarship, and the highest levels of advanced nursing practice. Faculty and student collaboration across DNP and PhD programs provide new approaches for translating research into practice and generating practice questions in need of further scientific development. Specific faculty development strategies for facilitating this collaboration are essential. Capstone projects pose special opportunities for faculty development due to the integration of these projects within diverse practice environments, with differing expectations, regulations, and pacing compared with research. Linking new care delivery models with health informatics is expected to facilitate rapid translation of research and development of improvements in practice. [J Nurs Educ. 2013;52(8):453-461.] [PUBLICATION ABSTRACT]";1555292293;;;Scholarly Journals;;"Sebastian, Juliann G;White Delaney, Connie"; JNUEAW;;; Copyright 2013, SLACK Incorporated; 10.3928/01484834-20130722-02; Journal Article;;; Aug 2013;;0148-4834;8; English; English;; 453-461; Thorofare;Aug 2013;Journal of Nursing Education;;2013;;;52;https://search.proquest.com/docview/1555292293?accountid=11774;;;;;; 453;;;;;"http://sfx.nelliportaali.fi/nelli09b?url_ver=Z39.88-2004&amp;rft_val_fmt=info:ofi/fmt:kev:mtx:journal&amp;genre=article&amp;sid=ProQ:ProQ%3Aeducation&amp;atitle=Doctor+of+Nursing+Practice+Programs%3A+Opportunities+for+Faculty+Development%3A+%5B1%5D&amp;title=Journal+of+Nursing+Education&amp;issn=01484834&amp;date=2013-08-01&amp;volume=52&amp;issue=8&amp;spage=453&amp;au=Sebastian%2C+Juliann+G%3BWhite+Delaney%2C+Connie&amp;isbn=&amp;jtitle=Journal+of+Nursing+Education&amp;btitle=&amp;rft_id=info:eric/&amp;rft_id=info:doi/10.3928%2F01484834-20130722-02";ProQuest Central,Social Science Premium Collection
Doctor of Nursing Practice Programs: Opportunities for Faculty Development;"  This article examines development opportunities for faculty teaching in Doctor of Nursing Practice (DNP) programs. Although faculty development for DNP programs is similar to that of other academic programs, faculty may need different strategies for teaching, scholarship, and service because DNP programs focus on translation of science into practice, systems-level changes, clinical scholarship, and the highest levels of advanced nursing practice. Faculty and student collaboration across DNP and PhD programs provide new approaches for translating research into practice and generating practice questions in need of further scientific development. Specific faculty development strategies for facilitating this collaboration are essential. Capstone projects pose special opportunities for faculty development due to the integration of these projects within diverse practice environments, with differing expectations, regulations, and pacing compared with research. Linking new care delivery models with health informatics is expected to facilitate rapid translation of research and development of improvements in practice. [ J Nurs Educ. 2013;52(8):453--461.]";1416812082; 23909564;;Scholarly Journals;;"Sebastian, Juliann G, PhD, RN, FAAN;White Delaney, Connie, PhD, RN, FAAN, FACMI"; JNUEAW;;; Copyright 2013, SLACK Incorporated; 10.3928/01484834-20130722-02; Journal Article;;; Aug 2013;;0148-4834;8; English; English;; 453-461; Thorofare;Aug 2013;Journal of Nursing Education;;2013;;;52;https://search.proquest.com/docview/1416812082?accountid=11774;;; Tables;;; 453;; Education, Nursing, Baccalaureate -- organization & administration , Humans , Nursing Informatics -- organization & administration , Nursing Research -- organization & administration , Program Development; Graduate studies , Nursing education , Teacher education , Experiential learning , United States--US;;"http://sfx.nelliportaali.fi/nelli09b?url_ver=Z39.88-2004&amp;rft_val_fmt=info:ofi/fmt:kev:mtx:journal&amp;genre=article&amp;sid=ProQ:ProQ%3Aeducation&amp;atitle=Doctor+of+Nursing+Practice+Programs%3A+Opportunities+for+Faculty+Development&amp;title=Journal+of+Nursing+Education&amp;issn=01484834&amp;date=2013-08-01&amp;volume=52&amp;issue=8&amp;spage=453&amp;au=Sebastian%2C+Juliann+G%2C+PhD%2C+RN%2C+FAAN%3BWhite+Delaney%2C+Connie%2C+PhD%2C+RN%2C+FAAN%2C+FACMI&amp;isbn=&amp;jtitle=Journal+of+Nursing+Education&amp;btitle=&amp;rft_id=info:eric/23909564&amp;rft_id=info:doi/10.3928%2F01484834-20130722-02";ProQuest Central,Social Science Premium Collection
EFFECT OF PROBLEM-BASED LEARNING ON SENIOR SECONDARY SCHOOL STUDENTS' ACHIEVEMENTS IN FURTHER MATHEMATICS;  The study investigated the effect of Problem-based learning (PBL) on senior secondary school students' achievements in Further Mathematics (FM) in Nigeria within the blueprint of pre-test-post-test non-equivalent control group quasi-experimental design. Intact classes were used and in all, 96 students participated in the study (42 in the experimental group taught with the PBL and 54 in the control group taught using the Traditional Method (TM)). One research instrument manipulated at two levels namely: Teacher-Made Test (TMT) and Researcher-Designed Test (RDT), was developed and used for the study and data collected were analysed using the descriptive statistics of mean and standard deviation which served as precursor to testing the two hypotheses for the study using an independent samples t-test. Results showed that there were statistically significant differences in the mean post-test achievement scores on TMT and mean post-test achievement scores on RDT between students exposed to the PBL and those exposed to the TM, all in favour of the PBL group. Based on the results, the study recommended that the PBL should be adopted as alternative instructional strategy to the TM in enhancing meaningful learning in Further Mathematics classrooms and efforts should be made to integrate the philosophy of PBL into the pre-service teachers' curriculum at the teacher-preparation institutions in Nigeria. [PUBLICATION ABSTRACT];1505017641;;;Scholarly Journals;;"Fatade, Alfred Olufemi;Mogari, David;Arigbabu, Abayomi Adelaja";;;; Copyright Babes Bolyai University, Didactics of Exact Sciences Chair 2013;; Feature;;; 2013;;;3; English; English;; 27-43; Cluj-Napoca;2013;Acta Didactica Napocensia;;2013;;;6;https://search.proquest.com/docview/1505017641?accountid=11774;;; References , Tables;;; 27;;; Studies , Teaching , Core curriculum , Teachers , Education , Cognitive ability , Mathematics , Learning , Cognition & reasoning , Textbooks , Governmental reform , Nigeria , Namibia;;"http://sfx.nelliportaali.fi/nelli09b?url_ver=Z39.88-2004&amp;rft_val_fmt=info:ofi/fmt:kev:mtx:journal&amp;genre=article&amp;sid=ProQ:ProQ%3Aeducation&amp;atitle=EFFECT+OF+PROBLEM-BASED+LEARNING+ON+SENIOR+SECONDARY+SCHOOL+STUDENTS%27+ACHIEVEMENTS+IN+FURTHER+MATHEMATICS&amp;title=Acta+Didactica+Napocensia&amp;issn=&amp;date=2013-07-01&amp;volume=6&amp;issue=3&amp;spage=27&amp;au=Fatade%2C+Alfred+Olufemi%3BMogari%2C+David%3BArigbabu%2C+Abayomi+Adelaja&amp;isbn=&amp;jtitle=Acta+Didactica+Napocensia&amp;btitle=&amp;rft_id=info:eric/&amp;rft_id=info:doi/";ProQuest Central,Social Science Premium Collection
Semantic Wiki: A Tool for Collaborative Learning Environment in Computer Engineering Education;  Computer engineering education encourages students to enhance their communication skills, critical thinking, analysis capabilities and abilities with group working. A successful way of improving student abilities is to organize them in work teams for specific tasks. These specific tasks play an important role for computer engineering students to gain habit of working together during all stages of a project development. Active learning methods can be used in the development of fundamental student qualifications. Collaborative learning methods such as project oriented learning and problem based learning are beneficial techniques to accomplish powerful active learning to promote engineering student's creative and critical thinking. In recent years, web-based collaborative learning strategies have emerged with the growing usage of Web 2.0 based internet technologies which allow web users to create and exchange information actively. One of the most popular tools is the Media Wiki platform used for collaboration among students in web-based education. This Wiki tool creates new opportunities for students to edit learning resources and to share, create, discuss or to modify their projects together. Wikis are mature technology constructed with new trends in e-leaming education such as discussion pages and history pages. On the other hand, Semantic Wiki that is a combination of Wiki and Semantic Web (Web 3.0) technology has not completely explored yet. Semantic Wiki enables users more advanced searching and navigation facilities by using annotations of course materials. In this paper, we introduce the opportunities of Media Wiki and Semantic Wiki platforms for collaborative computer engineering education. [PUBLICATION ABSTRACT];1470365168;;;Scholarly Journals;;"Çetin, Gürcan;Karakis, Rukiye;Çetin, Aydin";;;; Copyright Nesibe Aydin Education Institutions 2013;; Feature;;; 2013;;2146-8249;4; English; English;; 77-86; Ankara;2013;Journal of Education and Future;;2013;;;;https://search.proquest.com/docview/1470365168?accountid=11774;;; Diagrams , Photographs , References;;; 77;;; College students , Education , Studies , School environment , Programming languages , Learning , Computer networks , Computer engineering , Critical thinking , Semantics , Independent study;;"http://sfx.nelliportaali.fi/nelli09b?url_ver=Z39.88-2004&amp;rft_val_fmt=info:ofi/fmt:kev:mtx:journal&amp;genre=article&amp;sid=ProQ:ProQ%3Aeducation&amp;atitle=Semantic+Wiki%3A+A+Tool+for+Collaborative+Learning+Environment+in+Computer+Engineering+Education&amp;title=Journal+of+Education+and+Future&amp;issn=21468249&amp;date=2013-07-01&amp;volume=&amp;issue=4&amp;spage=77&amp;au=%C3%87etin%2C+G%C3%BCrcan%3BKarakis%2C+Rukiye%3B%C3%87etin%2C+Aydin&amp;isbn=&amp;jtitle=Journal+of+Education+and+Future&amp;btitle=&amp;rft_id=info:eric/&amp;rft_id=info:doi/";ProQuest Central,Social Science Premium Collection
