Title;Abstract;StoreId;AccessionNumber;AlternateTitle;ArticleType;AuthorAffiliation;Authors;coden;companies;contractNumber;copyright;digitalObjectIdentifier;documentType;elecISSN;elecPubDate;entryDate;isbn;issn;issue;language;languageOfSummary;originalTitle;pages;placeOfPublication;pubdate;pubtitle;publicationType;year;publisher;sourceAttrib;volume;DocumentURL;classification;classificationCodes;documentFeatures;majorClassificationCodes;notes;startPage;subjectClassifications;subjectHeadings;subjectTerms;subjects;FindACopy;Database
Tour Guide Robots: An Integrated Research and Design Platform to Prepare Engineering and Technology Students;  Many interesting research and design questions occur at the intersections of traditional disciplines, yet most coursework and research programs for undergraduate engineering students are focused on one discipline. This leads to underutilization of the potential in better preparing students through multidisciplinary projects. Identifying this opportunity to better prepare the engineering and technology students, this paper presents a multidisciplinary integrated research and design platform on tour guide robots. Through integration of electrical hardware, mechanical systems, design manufacture, and complex programming, the proposed work serves as an ideal platform through which students will be able to study a complex and integrated engineering system. Preliminary implementation of the proposed platform has led to numerous undergraduate research projects, capstone senior design projects, course improvements, publications in peer-reviewed conferences, and best student paper awards.;1812638086;;;Scholarly Journals;;Yelamarthi, Kumar;;;; Copyright Institute for SMET Education and Research Apr-Jun 2016;; Feature;;; Apr-Jun 2016;;1557-5276;2; English; English;; 51-56; Auburn;Apr-Jun 2016;Journal of STEM Education : Innovations and Research;;2016;;;17;https://search.proquest.com/docview/1812638086?accountid=11774;;; Tables , References , Diagrams , Photographs;;; 51;;; Sensors , Design , Curricula , Students , Research , Global positioning systems--GPS , Engineering , Robots , Satellites , Radio frequency identification , Robotics , Blindness , Collaboration , Researchers , Localization , United States--US;;"http://sfx.nelliportaali.fi/nelli09b?url_ver=Z39.88-2004&amp;rft_val_fmt=info:ofi/fmt:kev:mtx:journal&amp;genre=article&amp;sid=ProQ:ProQ%3Aeducation&amp;atitle=Tour+Guide+Robots%3A+An+Integrated+Research+and+Design+Platform+to+Prepare+Engineering+and+Technology+Students&amp;title=Journal+of+STEM+Education+%3A+Innovations+and+Research&amp;issn=15575276&amp;date=2016-04-01&amp;volume=17&amp;issue=2&amp;spage=51&amp;au=Yelamarthi%2C+Kumar&amp;isbn=&amp;jtitle=Journal+of+STEM+Education+%3A+Innovations+and+Research&amp;btitle=&amp;rft_id=info:eric/&amp;rft_id=info:doi/";ProQuest Central,SciTech Premium Collection,Social Science Premium Collection
Using Critical Social Heuristics and Project-Based Learning to Enhance Data Warehousing Education;  The aim of this paper is to demonstrate how project-based learning can be used from a critical systems perspective in data warehousing education. Data warehousing is a discipline in information technology focusing on providing data-driven decision support systems for strategic decision making. In this study we used action research from a critical (emancipative) perspective to reflect on our current instructional design of the data warehousing module before redesigning it to better serve the needs of the involved and affected. We used critical systems heuristics and project-based learning as frameworks of understanding to guide our intervention. Project-based learning is a learning/teaching approach aimed at organising the learning experience in terms of a project. We used written interpretive interviews in the diagnosis and evaluation of success phases of our action research cycle. Our reflection is according to the action research model of Checkland reflecting on our success in the area of application (data warehousing instruction) as well as our methodology (action research from a critical social theory perspective) and our framework of ideas (project-based learning and critical social heuristics).;1771300062;;;Scholarly Journals;;"Taylor, Estelle;Goede, Roelien";;;; Springer Science+Business Media New York 2016; 10.1007/s11213-015-9357-0; Journal Article;;; Apr 2016;;1094-429X;2; English; English;; 97-128; New York;Apr 2016;Systemic Practice and Action Research;;2016;;;29;https://search.proquest.com/docview/1771300062?accountid=11774;;;;;; 97;;;; Critical social heuristics , Project-based learning , Data warehousing education , Critical systems thinking , Action research;"http://sfx.nelliportaali.fi/nelli09b?url_ver=Z39.88-2004&amp;rft_val_fmt=info:ofi/fmt:kev:mtx:journal&amp;genre=article&amp;sid=ProQ:ProQ%3Aabiglobal&amp;atitle=Using+Critical+Social+Heuristics+and+Project-Based+Learning+to+Enhance+Data+Warehousing+Education&amp;title=Systemic+Practice+and+Action+Research&amp;issn=1094429X&amp;date=2016-04-01&amp;volume=29&amp;issue=2&amp;spage=97&amp;au=Taylor%2C+Estelle%3BGoede%2C+Roelien&amp;isbn=&amp;jtitle=Systemic+Practice+and+Action+Research&amp;btitle=&amp;rft_id=info:eric/&amp;rft_id=info:doi/10.1007%2Fs11213-015-9357-0";ProQuest Central
Progress testing: critical analysis and suggested practices;Educators have long lamented the tendency of students to engage in rote memorization in preparation for tests rather than engaging in deep learning where they attempt to gain meaning from their studies. Rote memorization driven by objective exams has been termed a steering effect. Progress testing (PT), in which a comprehensive examination sampling all of medicine is administered repeatedly throughout the entire curriculum, was developed with the stated aim of breaking the steering effect of examinations and of promoting deep learning. PT is an approach historically linked to problem-based learning (PBL) although there is a growing recognition of its applicability more broadly. The purpose of this article is to summarize the salient features of PT drawn from the literature, provide a critical review of these features based upon the same literature and psychometric considerations drawn from the Standards for Educational and Psychological Testing and provide considerations of what should be part of best practices in applying PT from an evidence-based and a psychometric perspective.;2259116551;;;Scholarly Journals; University of Wisconsin-Madison Medical School, National Conference of Bar Examiners, Madison, WI, USA , Ajijic, Jalisco, Mexico;"Albanese, Mark;Case, Susan M";;;; Advances in Health Sciences Education is a copyright of Springer, (2015). All Rights Reserved.; 10.1007/s10459-015-9587-z; Journal Article;; 2015-02-07; Mar 2016;;1382-4996;1; English; English;; 221-234; Dordrecht;Mar 2016;Advances in Health Sciences Education;;2016;;;21;https://search.proquest.com/docview/2259116551?accountid=11774;;;;; 2015-01-22 (Registration) , 2014-12-02 (Received) , 2015-01-19 (Accepted); 221;;; Deep learning , Quantitative psychology; Progress testing , Longitudinal assessment , Formative assessment , High stakes assessment;"http://sfx.nelliportaali.fi/nelli09b?url_ver=Z39.88-2004&amp;rft_val_fmt=info:ofi/fmt:kev:mtx:journal&amp;genre=article&amp;sid=ProQ:ProQ%3Aeducation&amp;atitle=Progress+testing%3A+critical+analysis+and+suggested+practices&amp;title=Advances+in+Health+Sciences+Education&amp;issn=13824996&amp;date=2016-03-01&amp;volume=21&amp;issue=1&amp;spage=221&amp;au=Albanese%2C+Mark%3BCase%2C+Susan+M&amp;isbn=&amp;jtitle=Advances+in+Health+Sciences+Education&amp;btitle=&amp;rft_id=info:eric/&amp;rft_id=info:doi/10.1007%2Fs10459-015-9587-z";ProQuest Central,Social Science Premium Collection
Evaluación sostenible de experiencias de aprendizaje basado en proyectos/Sustainable assessment of learning experiences based on projects;  In a project-based learning experience, the detailed monitoring of the activities in which team members participate can be useful to evaluate their work. Using learning-oriented assessment procedures, supervisors can assess the teamwork abilities with a formative purpose. Evaluation strategies such as self-assessment, peer assessment and co-assessment are often used to make evaluation formative and sustainable. Conducting an assessment strategy is not easy for team members, since they need before to have a reasonable understanding of the evaluation process and criteria. This paper describes a learning-oriented evaluation methodology and an open data framework that can be applied to collaborative project settings. An evaluation rubric and a series of indicators that provide evidences about the developed skills have been elaborated and applied in a small-scale project-based course. Projects were managed and developed with the help of an open source software forge that contains a ticketing tool for planning and tracking of tasks, a version control repository to save the software outcomes, and using a wiki to host text deliverables. The experience provides evidences in favor of using the assessment method and open data framework to make teamwork evaluation more sustainable.;1792366486;;;Scholarly Journals;;"Traverso-Ribón, Ignacio;Balderas-Alberico, Antonio;Dodero, Juan Manuel;Ruiz-Rube, Iván;Palomo-Duarte, Manuel";;;; Copyright Ediciones Universidad de Salamanca Mar 2016; 10.14201/eks2016171943; Feature;;; Mar 2016;;;1; English , Spanish; English;; 19-43; Salamanca;Mar 2016;Education in the Knowledge Society;;2016;;;17;https://search.proquest.com/docview/1792366486?accountid=11774;;; Tables , References , Graphs , Diagrams;;; 19;;; Learning , Projects , Software , Wikis;;"http://sfx.nelliportaali.fi/nelli09b?url_ver=Z39.88-2004&amp;rft_val_fmt=info:ofi/fmt:kev:mtx:journal&amp;genre=article&amp;sid=ProQ:ProQ%3Aeducation&amp;atitle=Evaluaci%C3%B3n+sostenible+de+experiencias+de+aprendizaje+basado+en+proyectos%2FSustainable+assessment+of+learning+experiences+based+on+projects&amp;title=Education+in+the+Knowledge+Society&amp;issn=&amp;date=2016-03-01&amp;volume=17&amp;issue=1&amp;spage=19&amp;au=Traverso-Rib%C3%B3n%2C+Ignacio%3BBalderas-Alberico%2C+Antonio%3BDodero%2C+Juan+Manuel%3BRuiz-Rube%2C+Iv%C3%A1n%3BPalomo-Duarte%2C+Manuel&amp;isbn=&amp;jtitle=Education+in+the+Knowledge+Society&amp;btitle=&amp;rft_id=info:eric/&amp;rft_id=info:doi/10.14201%2Feks2016171943";ProQuest Central,Social Science Premium Collection
Evaluation of Parallel Authentic Research-Based Courses in Human Biology on Student Experiences at Stanford University and the University of Gothenburg;Under a previous grant (2005-08), researchers and teachers at Stanford University (SU) and the University of Gothenburg (GU) co-designed a ten-week interdisciplinary, research-based laboratory course in human biology to be taught online to undergraduate students. Essentials in the subject were taught during the first four weeks of this course. Subsequently, student groups at SU and GU developed their own research questions, conducted live-streamed experiments remotely, processed their unique data with support from multiple interactive resources, cross-cultural collaboration and an interdisciplinary network of expert consultants, and presented original scientific results remotely. Student course-perceptions were evaluated using online questionnaires, scientific logbooks, and observations. In student teams from both universities, the course concept clearly improved student abilities to conduct research using laboratory experiments while learning theoretical basics. A comparison of pre and post course scores from student surveys showed that post course student comfort levels with several research-related tasks increased radically at both universities. All participating staff generally agreed that the methods and tools were valuable in this type of course and should be evaluated at other levels and areas of higher education, and shared in an expanded network of universities.;2387854491;;;Scholarly Journals;;"Lindh, Jacob;Annerstedt, Claes;Besier, Thor;Matheson, Gordon O;Rydmark, Martin";;" Stanford University
611310";; © 2016. This work is published under https://creativecommons.org/licenses/by/4.0  (the “License”). Notwithstanding the ProQuest Terms and Conditions, you may use this content in accordance with the terms of the License.; 10.14434//josotl.v16i5.19975; Case Study;; 2019-10-31; 2016;;1527-9316;5; English; English;; 70-91; Indianapolis;2016;Journal of the Scholarship of Teaching and Learning;;2016;;;16;https://search.proquest.com/docview/2387854491?accountid=11774;;;;; 2016-10-31 (Created) , 2015-09-08 (Submitted) , 2016-10-31 (Issued) , 2016-10-31 (Modified); 70;;; Laboratories , Research , Science education , Interdisciplinary aspects , Blended learning , Problem based learning; Key words , Authentic reseach , problem-based learning , blended learning , interdisciplinary , higher education , human biology;"http://sfx.nelliportaali.fi/nelli09b?url_ver=Z39.88-2004&amp;rft_val_fmt=info:ofi/fmt:kev:mtx:journal&amp;genre=unknown&amp;sid=ProQ:ProQ%3Aeducation&amp;atitle=Evaluation+of+Parallel+Authentic+Research-Based+Courses+in+Human+Biology+on+Student+Experiences+at+Stanford+University+and+the+University+of+Gothenburg&amp;title=Journal+of+the+Scholarship+of+Teaching+and+Learning&amp;issn=15279316&amp;date=2016-01-01&amp;volume=16&amp;issue=5&amp;spage=70&amp;au=Lindh%2C+Jacob%3BAnnerstedt%2C+Claes%3BBesier%2C+Thor%3BMatheson%2C+Gordon+O%3BRydmark%2C+Martin&amp;isbn=&amp;jtitle=Journal+of+the+Scholarship+of+Teaching+and+Learning&amp;btitle=&amp;rft_id=info:eric/&amp;rft_id=info:doi/10.14434%2F%2Fjosotl.v16i5.19975";ProQuest Central,Social Science Premium Collection
Small Group Learning Methods And Their Effect On Learners’ Relationships;Building relationships in the classroom is an essential part of any teacher's career. Having healthy teacher-to-learner and learner-to-learner relationships is an effective way to help prevent pedagogical failure, social conflict and quarrelsome behavior. Many strategies are available that can be used to achieve good long-lasting relationships in the classroom setting. Successful teachers’ pedagogical work in the classroom requires detailed knowledge of learners’ relationships. Good understanding of the relationships is necessary, especially in the case of teenagers’ class. This sensitive period of adolescence demands attention of all teachers who should deal with the problems of their learners. Special care should be focused on children that are out of their classmates’ interest (so called isolated learners or isolates) in such class and on possibilities to integrate them into the class. Natural idea how to do it is that of using some modern non-traditional teaching/learning methods, especially the methods based on work in small groups involving learners’ cooperation. Small group education (especially problem-based learning, project-based learning, cooperative learning, collaborative learning or inquire-based learning) as one of these methods involves a high degree of interaction. The effectiveness of learning groups is determined by the extent to which the interaction enables members to clarify their own understanding, build upon each other's contributions, sift out meanings, ask and answer questions. An influence of this kind of methods (especially cooperative learning (CL)) on learners’ relationships was a subject of the further described research. Within the small group education, students work with their classmates to solve complex and authentic problems that help develop content knowledge as well as problem-solving, reasoning, communication, and self-assessment skills. The aim of the research was to answer the question: Can the cooperative learning methods help to integrate isolated learners into the class? The research was realized as a pre-test-post-test design for the sample of 207 learners of first, second and third grades of lower secondary school. Standardized sociometric questionnaire B-3 was used to determine the number of isolated learners before and after using the CL methods. Consequently, using the Wilcoxon statistic test of significance, the hypothesis was verified that the number of isolates after the CL methods is statistically significantly lower than that of the case before using the non-traditional teaching/learning method. Accordingly, the research results justify implementation CL methods into education.;2343798478;;;Scholarly Journals;;"Borůvková, R;Emanovský, P";;;; © 2016. This work is published under https://creativecommons.org/licenses/by-nc/4.0/  (the “License”). Notwithstanding the ProQuest Terms and Conditions, you may use this content in accordance with the terms of the License.;; Journal Article;;; 2016;;1822-7864;; English; English;; 45–58; Šiauliai;2016;Problems of Education in the 21st Century;;2016;;;70;https://search.proquest.com/docview/2343798478?accountid=11774;;;;; 2016-04-01 (published); 45;;; Cooperative learning , Pedagogy , Classrooms , Teaching methods , Teachers , Education; cooperative learning , isolated learners , learners’ relationships , small group learning methods , sociometric methods;"http://sfx.nelliportaali.fi/nelli09b?url_ver=Z39.88-2004&amp;rft_val_fmt=info:ofi/fmt:kev:mtx:journal&amp;genre=article&amp;sid=ProQ:ProQ%3Aeducation&amp;atitle=Small+Group+Learning+Methods+And+Their+Effect+On+Learners%26rsquo%3B+Relationships&amp;title=Problems+of+Education+in+the+21st+Century&amp;issn=18227864&amp;date=2016-01-01&amp;volume=70&amp;issue=&amp;spage=45&amp;au=Bor%C5%AFvkov%C3%A1%2C+R%3BEmanovsk%C3%BD%2C+P&amp;isbn=&amp;jtitle=Problems+of+Education+in+the+21st+Century&amp;btitle=&amp;rft_id=info:eric/&amp;rft_id=info:doi/";ProQuest Central,Social Science Premium Collection
Exploring differences in industry supervisors' ratings of student performance on WIL placements and the relative importance of skills: Does remuneration matter?;Assessment in work integrated learning (WIL) programs typically involves workplace supervisors rating student performance against criteria based on employability skills. Yet investigations of differences in employer ratings that may impact on student outcomes are rare. This study reports on a pilot study that examined supervisor evaluations of the performance of tourism and hospitality management students undertaking a mandatory capstone internship, either paid or non-remunerated. The descriptive and exploratory statistical analysis examines data derived from over one hundred supervisor evaluation forms. A few significant differences in supervisor ratings of performance in paid and unpaid groups and in the relative importance of skills were found. Overall, the study affirmed that supervisors generally rate students highly on all skills. The skills that students are prepared for and assessed on in our WIL program were found to be of high value to local hosts. Implications for debates regarding supervisory input into assessing student performance are explored.;2231188723;;;Scholarly Journals;;"Milne, Lisa;Caldicott, Julia";;;; © 2016. Notwithstanding the ProQuest Terms and Conditions, you may use this content in accordance with the associated terms available at https://www.ijwil.org/access-and-costs;; Journal Article;;; 2016;;;2; English; English;; 175-186; Hamilton;2016;Asia-Pacific Journal of Cooperative Education;;2016;;;17;https://search.proquest.com/docview/2231188723?accountid=11774;;;;;; 175;;; Supervisors; Work-integrated learning , competencies , WIL assessment , workplace assessor ratings , paid/unpaid placement;"http://sfx.nelliportaali.fi/nelli09b?url_ver=Z39.88-2004&amp;rft_val_fmt=info:ofi/fmt:kev:mtx:journal&amp;genre=article&amp;sid=ProQ:ProQ%3Aeducation&amp;atitle=Exploring+differences+in+industry+supervisors%27+ratings+of+student+performance+on+WIL+placements+and+the+relative+importance+of+skills%3A+Does+remuneration+matter%3F&amp;title=Asia-Pacific+Journal+of+Cooperative+Education&amp;issn=&amp;date=2016-01-01&amp;volume=17&amp;issue=2&amp;spage=175&amp;au=Milne%2C+Lisa%3BCaldicott%2C+Julia&amp;isbn=&amp;jtitle=Asia-Pacific+Journal+of+Cooperative+Education&amp;btitle=&amp;rft_id=info:eric/&amp;rft_id=info:doi/";ProQuest Central,Social Science Premium Collection
Crowdsourcing benefits in postgraduate project supervision: Sefako Makgatho Health Sciences University statistics and computer science case study;The paper reports on the findings made on an experiential exercise of Bachelor of Science Honours in Statistics (BSc Hons Stat) in the Department of Statistics and Operations Research (SOR) of the Sefako Makgatho Health Sciences University (SMU) in South Africa. SOR is a small, understaffed department, which offers courses for degrees from Bachelor to Doctoral levels in the subfields of Artificial Intelligence, Data Mining, Operations Research, Statistics and related ones. On SMU campus, expertize in some of these fields is also available in the Department of Computer Science (DCS). In the 2015 academic year SOR admitted 20 BSc Hons Stat students beyond its staffing capacity. Then, SOR invited DCS in a crowdsourcing initiative to jointly supervise student projects in the various subfields mentioned. The challenges include conflict and limited experience. These are managed satisfactorily though, but mainly because they occur at low levels. This crowdsourcing arrangement nevertheless results in timely submissions of final projects, improved quality projects worthy of being published, innovation, quality teamwork, and some synergistic outcomes. Coordinators also learn and/or improved some project management skills;2221317347;;;Scholarly Journals;;"Seeletse, Solly Matshonisa;Tsakani Violet Ndobe;Tichavasia, Alex Dandadzi;Hungwe, Taurai";;;; © 2016. Notwithstanding the ProQuest Terms and Conditions, you may use this content in accordance with the associated terms available at https://businessperspectives.org/journals/environmental-economics#aims-and-scope; 10.21511/ee.07(2).2016.13; Case Study;;; 2016;;1998-6041;2; English; English;; 122-129; Sumy;2016;Environmental Economics;;2016;;;7;https://search.proquest.com/docview/2221317347?accountid=11774;;;;; 2016-06-03 (Released); 122;;; Operations research , Health sciences , Computer science , Crowdsourcing;;"http://sfx.nelliportaali.fi/nelli09b?url_ver=Z39.88-2004&amp;rft_val_fmt=info:ofi/fmt:kev:mtx:journal&amp;genre=unknown&amp;sid=ProQ:ProQ%3Aabiglobal&amp;atitle=Crowdsourcing+benefits+in+postgraduate+project+supervision%3A+Sefako+Makgatho+Health+Sciences+University+statistics+and+computer+science+case+study&amp;title=Environmental+Economics&amp;issn=19986041&amp;date=2016-01-01&amp;volume=7&amp;issue=2&amp;spage=122&amp;au=Seeletse%2C+Solly+Matshonisa%3BTsakani+Violet+Ndobe%3BTichavasia%2C+Alex+Dandadzi%3BHungwe%2C+Taurai&amp;isbn=&amp;jtitle=Environmental+Economics&amp;btitle=&amp;rft_id=info:eric/&amp;rft_id=info:doi/10.21511%2Fee.07%282%29.2016.13";ProQuest Central
